{
  "schema_version": "1.0.0",
  "generated_at": "2026-07-14T17:35:24Z",
  "source_commit": "4dbb6eb4aa5a3c9f22d8a590cb6c9539f411330a",
  "source_paths": [
    "docs/quantmind2/context/CONTEXT_INDEX.md",
    "docs/quantmind2/architecture/QUANTMIND_2_ARCHITECTURE_V1.md",
    "docs/quantmind2/context/CURRENT_STATE.md",
    "docs/quantmind2/context/HANDOFF.md"
  ],
  "authority_level": "derived_handoff",
  "freshness_status": "current_at_base_commit",
  "verification_status": "verified",
  "repository": "/Users/yj/Documents/Codex/2026-07-13/qusong0627-quantmind-git-https-github-com/",
  "branch": "master",
  "base_commit": "4dbb6eb4aa5a3c9f22d8a590cb6c9539f411330a",
  "workspace_dirty": false,
  "unrelated_dirty_files": [],
  "factor_lab_source": {
    "root": "/tmp/quantmind_factor_lab_real_bounded_v7_orchestrator_v1/",
    "source_path": "/tmp/quantmind_factor_lab_real_bounded_v7_orchestrator_v1/backend/services/engine/factor_lab/",
    "branch": "factor-lab/real-bounded-v7-orchestrator-v1",
    "commit": "c83192c2278767e03f008bc39197b1ba33bfb6a9",
    "read_only": true
  },
  "architecture_version": "v1",
  "current_task": "QM2-P0-002A2a2b1",
  "completion_status": "completed_committed",
  "latest_implementation_run": "QM2-P0-002A2a2b1-20260714T173524Z-4dbb6eb",
  "next_recommended_tasks": ["QM2-P0-002"],
  "unconfirmed_facts": [
    "Concrete TongDaXin Provider implementation and capability contract.",
    "Durable long-term location for the official Factor Lab source.",
    "Operational invocation, order, and checksum tracking for incremental SQL migrations.",
    "Permission and search-path support for an explicit quantmind2 PostgreSQL schema.",
    "Isolated PostgreSQL fixture and CI PostgreSQL capability.",
    "Storage backend for large snapshot and ledger artifacts.",
    "Manifest v1 lacks a first-class non-correction related_run_id field.",
    "Concrete actor identity and permission policy for ResearchDecision.",
    "Persistent idempotency-key and semantic-duplicate policy.",
    "Manifest v1 mapping for annotation records, general Run relationships, logical repository identity, and richer domain enums.",
    "PostgreSQL realization of Repository uniqueness, expected versions, DAG checks, and atomic batch behavior.",
    "SQLAlchemy 2.0.25 pinned-runtime DDL compilation and real PostgreSQL behavior; A2a1, A2a2a, and A2a2b1 used an existing SQLAlchemy 2.0.51 environment."
  ],
  "protected_constraints": [
    "Do not replace existing LightGBM or Qlib.",
    "Do not use Python factor_impl.py in the v1 standard factor path.",
    "Keep Factor, Model, and Portfolio optimization separate.",
    "Keep Research Memory, Project Architecture Memory, and Implementation Ledger separate.",
    "Do not expose Frozen Test to Agent, Optimizer, or Campaign Memory.",
    "Do not silently modify accepted ADRs.",
    "Decision Layer may propose actions but cannot claim execution success.",
    "Code Orchestrator is the only controlled boundary to execution services.",
    "Execution services cannot autonomously choose the next research action."
  ],
  "mandatory_read_order": [
    "docs/quantmind2/context/CONTEXT_INDEX.md",
    "docs/quantmind2/context/PROJECT_CHARTER.md",
    "docs/quantmind2/architecture/QUANTMIND_2_ARCHITECTURE_V1.md",
    "docs/quantmind2/context/CURRENT_STATE.md",
    "docs/quantmind2/context/HANDOFF.md",
    "docs/quantmind2/adr/ADR_INDEX.md",
    "docs/quantmind2/context/COMPONENT_CATALOG.md",
    "docs/quantmind2/implementation/README.md",
    "docs/quantmind2/adr/ADR-0009-decision-control-execution-separation.md",
    "docs/quantmind2/architecture/RESEARCH_DECISION_CONTRACT_V1.md"
  ],
  "uncommitted_work": false
}
